"Case#","Date","Time","Description","Location","Date_Time","Notes"
"230101","2023 03 13","1146","Information Only","Off Campus",1678707960,"Notes: Dispatch received an emailed report of a Reed owned off-property storage unit being burglarized. The unit had been accessed using the Reed gate code, then the lock had been cut and items had been removed from the unit. The reporting party also filed a police report."
"230102","2023 03 14","1622","Medical Transport - Other","Administrative building",1678810920,"Notes: A CSO responded to a request for medical assistance in an administrative building. The CSO met with a Reed community member experiencing physical distress. Emergency medical services were requested and the community member was transported by American Medical Response to a nearby medical facility for further care."
"230103","2023 03 15","1519","Exclusion","Canyon",1678893540,"Notes: A CSO responded to a report of a suspicious person in the canyon. The description given matched that of an individual who had been asked to leave campus in the weeks before. The CSO intercepted the person matching the description and confirmed that it was the same person who had been asked to leave in a prior instance. The CSO again escorted the individual off of campus and issued a verbal exclusion during this interaction. The individual left campus without incident."
"230104","2023 03 15","2056","Medical Assist - Other","Residence hall",1678913760,"Notes: A CSO responded to a request for medical assistance in a residence hall. The CSO met with a student who was having trouble breathing and believed they had something lodged in their throat. The CSO remained with the student who, after some time, began feeling better. The CSO departed when the student’s friend arrived. The CSO provided the student with a pink emergency number card in case it was needed."
"230105","2023 03 07","0003","Damage to Property","West Lot",1678147380,"Notes: A CSO on patrol encountered the odor of gasoline. Upon investigating, the CSO encountered a Reed owned van with multiple puncture holes in its gas tank, from which gas was still leaking. The CSO used the contents of a spill bag to cover the gas on the ground and placed a cone in front of the van. Dispatch contacted the appropriate parties for clean up of the gas and needed repairs of the van."
"230106","2023 03 17","1003","Damage to Property","West Lot",1679047380,"Notes: CSOs responded to the West Lot regarding a report of a suspicious individual. Upon arrival, neither the individual, nor the vehicle presumably associated with them, were present. The CSOs did encounter the strong odor of gasoline. Upon inspecting the area, they discovered a Reed owned van with puncture holes in its gas tank. Reed maintenance was contacted for clean up of the gasoline. This is the second Reed van that had its gas tank punctured in less than 24 hours."
"230107","2023 03 17","1650","Exclusion","Steele Lot",1679071800,"Notes: A CSO on patrol near the Steele Lot encountered a known houseless individual camping in their trailer in the lot. The CSO spoke with the individual and, since this was not the first interaction with this individual camping on Reed property, issued a verbal exclusion. The individual stated they understood and left the property. "
"230109","2023 03 19","0618","Student Concern","Residence Hall",1679206680,"Notes: A CSO responded to a report of a student possibly experiencing a mental health crisis. The CSO engaged with the student and called the Area Coordinator On-Call (AC) for assistance. The student was eventually assisted by EMS and transported to a medical facility for care. "
"230110","2023 03 19","0909","Medical Assist - Other","Residence hall",1679216940,"Notes: A CSO responded to a request for medical assistance at a residence hall. The CSO met with a student who had concerns about their prescribed medication. The CSO remained with the student until the student felt confident that all was well. The CSO departed with the agreement that they would check back with the student later. When the CSO did so, the student was well."
"230111","2023 03 19","2200","Medical Assist - Drug related","residence hall",1679263200,"Notes: CSOs responded to a request for medical assistance at a residence hall. The CSOs met with a student who reported that they had accidentally ingested “poppers” and were unsure what to do. The CSOs remained with the student to observe their condition and after a short while they departed, as the student was feeling better. Upon leaving, the CSOs advised the student to Contact Community Safety if their condition worsened. "
"230091","2023 03 06","2254","Medical Assist - Other","Residence Hall",1678143240,"Notes: CSOs responded to a request for medical assistance in a residence hall. The CSOs met with a student experiencing physical distress. After assessing the student and discussing options, the student opted to follow up with their primary care physician, and the CSOs cleared from the call."
"230092","2023 03 07","1327","Damage to Property","GCC/Reed Community Pantry",1678195620,"Notes: Dispatch received an emailed report of vandalism at the Reed Community Pantry. It was reported that flyers were ripped off of the walls, a mural was defaced, and items from the front desk had been tampered with sometime during the night."
"230093","2023 03 07","2204","Smoking Violation","Doyle",1678226640,"Notes: This report is incomplete at this time."
"230094","2023 03 07","2238","Alcohol Violation","GCC",1678228680,"Notes: Two CSOs on patrol in the GCC observed a small group of students walk by them. One of the students was observed dropping a box of wine and attempting to make a quick exit from the building. One of the CSOs remained inside the building to dispose of the wine, while the other CSO made contact with the group of students. The CSOs then returned to their normal patrol duties."
"230096","2023 03 09","1249","Theft - Other","28 West",1678366140,"Notes: Three students arrived at 28 West to pick up a delivery of cupcakes that had been left for one of the students. The box had been left on the delivery table just outside of the west entrance to the building. The student to whom the cupcakes belonged re-entered the building to report that the box had been ripped open and one of the cupcakes had been removed. The Dispatcher and a Community Safety Manager (CSM) offered to watch the security camera footage to see if they could identify what had happened. While watching the footage, the Dispatcher and CSM observed that at approximately 1225 hours, a squirrel jumped up onto the table, ripped open the clear plastic on the top of the box, then left. Shortly after, the squirrel returned and removed one of the cupcakes. CSOs were unable to determine which of the dozens of squirrels living nearby had been the culprit. It remains at large. The student victim requested to record the security footage on their cell phone to share with the person who purchased the cupcakes for them, and Community Safety agreed to this record release."
"230097","2023 03 09","1747","Medical Assist - Other","HCC",1678384020,"Notes: The director of Community Safety responded to a request for assistance at the HCC. Upon arrival, the director met with a student who had arrived at the HCC to use their services, but the building was closed. The student had fallen into a stream and their clothes had become soaked. The director escorted the student to 28 West where an emergency warming blanket was brought to the student and a space heater was set up to help rewarm the student. Clean dry clothes were provided for the student to borrow and the student was given some warm tea. After the student had changed into warm clothes, the director assessed the student for any signs of hypothermia, of which there were none. The student remained at 28 West until they felt warm enough to leave. A CSO then provided the student with a vehicle escort to the student’s car."
"230099","2023 03 10","2215","Unattended Alcohol or Drugs","Woodbridge",1678486500,"Notes: A CSO on patrol near Woodbridge observed an unattended cigarette box on top of the wall near the building stairs. When the CSO inspected the box, they discovered two cannabis joints inside the box. The CSO asked some nearby students if the box was theirs, but no one claimed ownership of the box. The box and cannabis joints were confiscated and disposed of."
"230100","2023 03 11","1423","Medical Transport - Drug","Residence Hall",1678544580,"Notes: CSOs responded to a report of an individual experiencing negative side effects from taking psychedelics. The CSOs made contact with the resident who stated that they and a friend had taken LSD and their friend was “having a bad trip.” The CSOs observed that the resident was gently restraining their friend by their arm, and that the friend was bleeding from their scalp. The friend broke free of the resident’s grip and physically assaulted one of the CSOs. The CSO backed away from the individual and it was decided that emergency medical services would be contacted for assistance. The CSOs and resident remained with the individual until paramedics arrived and safely transported the individual to a nearby medical facility for further care. "
"230080","2023 02 27","1250","Graffiti","GCC Info Shop",1677502200,"Notes: A CSO responded to a report of new graffiti spray painted all over the walls of the GCC info shop. "
"230082","2023 03 02","1728","Medical Assist - Other","Sports Center",1677778080,"Notes: A CSO responded to a request for medical assistance at the Sports Center. Upon arrival, the CSO met with a Reed staff member, and a Reed community member who had sustained an injury. The CSO guided an ambulance to the location, and then cleared from the call once the community member had been safely transported to a medical facility for further care."
"230083","2023 03 03","0352","Damage to Property/Theft of Motor Vehicle/Clery Act Reportable Incident","Grove Lot",1677815520,"Notes: A CSO at 28 West observed two individuals dressed in all black, including hats and masks, exit a parked vehicle in the Grove Lot, and one of the two entered another vehicle. The CSO attempted to make contact with the individuals and when they did so, one individual yelled to the other, who then quickly exited the second vehicle. The two individuals got into their own vehicle and sped out of the lot. When the CSO investigated the vehicle that had been entered by one of the two individuals, they observed damage to the steering column and fuse box panel. The vehicle is not registered with Community Safety so the owner was not contacted, but the CSO did leave a Community Safety card inside the vehicle and locked all of the vehicle doors."
"230087","2023 03 04","0124","Medical Assist - Alcohol","Residence Hall",1677893040,"Notes: CSOs responded to a request for medical assistance in a residence hall. Upon arrival, they met with the reporting student who stated that another student had consumed an unknown amount of alcohol and had become unresponsive. In assessing the student in question, the CSOs observed that the student was unconscious and unresponsive. American Medical Response was requested and transported the student to a nearby medical facility for care."
"230089","2023 03 04","0516","Medical Assist - Other","Central Campus",1677906960,"Notes: CSOs responded to a request for medical assistance in central campus. Upon arrival, they met with the reporting party who stated that another student was experiencing symptoms of a known medical condition. American Medical Response was requested, and the student in question was transported to a nearby medical facility for further care."
"230090","2023 03 05","1343","Animal Issue","Northeast Quadrant",1678023780,"Notes: A CSO responded to a report of a dog fight near the entrance to the north parking lot. The CSO met with some non-community members who stated that while two people were walking their dogs, a third dog exited a nearby vehicle and began attacking one of the two dogs. Shortly after, another dog appeared, no owner in sight, and also began attacking the one dog. By the time the CSO arrived, the fight had been stopped and both of the off leash dogs had been contained. The dog that had been attacked was no longer on site, as it had sustained injuries and was taken to the veterinarian. Animal control arrived and took custody of both off-leash dogs."
"230076","2023 02 20","2030","Damage to Property","Grove Lot",1676925000,"Notes: A student arrived at 28 West to report that there had been an unsuccessful attempt to steal the license plate off of their vehicle. The student had installed anti-theft bolts, which showed signs of tampering. Additionally, the license plate was bent from an attempt to forcibly remove it from the vehicle."
"230077","2023 02 21","1627","Damage to Property/Theft of Motor Vehicle/Clery Act Reportable Incident","East Lot",1676996820,"Notes: A CSO responded to a report of a vehicle break-in in the East Lot. The CSO met with the vehicle owner who stated that they had returned to their vehicle to find that the ignition switch had been removed from the vehicle. The CSO encouraged the owner to report the damage to the Portland Police. Approximately six hours later, another CSO checking on the vehicle observed that the driver’s side door lock had been drilled out. This matched a pattern seen in prior situations in which after the door lock was removed, the vehicle was stolen. Dispatch contacted the vehicle owner and recommended that they remove the vehicle’s battery so that the vehicle could not be stolen before the owner had a chance to have it towed away for repairs. The vehicle owner did so."
"230078","2023 02 22","1351","Damage to Property","East Lot",1677073860,"Notes: A CSO on patrol encountered a vehicle with a shattered rear driver’s side window. The doors were locked and there appeared to be no other damage or signs of tampering."
"230079","2023 02 25","2322"," – ","GCC",1677367320,"Notes: This report is incomplete at this time."
"230061","2023 02 13","2116","Information Only","Campus",1676322960,"Notes: A student reported unwanted contact by a Reed alum. The director of Community Safety is following up on this report."
"230062","2023 02 14","0004","Information Only","Trillium",1676333040,"Notes: CSOs responded to an audible fire alarm in the Trillium residence hall. After a thorough search they determined that no signs of smoke or fire were present the CSOs reset the alarm panel and cleared from the call."
"230063","2023 02 14","0748","Medical Assist - Other","Residence Hall",1676360880,"Notes: CSOs responded to a possible medical emergency in a residence hall. There they met with a student with a known medical condition. After a short conversation with, and assessment of, the student, CSOs recommended that the student be seen for further medical care. The student agreed and arranged a ride to a nearby medical facility for further care."
"230064","2023 02 14","1219","Theft - Bike","Naito Hall",1676377140,"Notes: A student contacted the Community Safety Dispatcher to notify them that their bike had been stolen from the bike rack outside of Naito Hall where it had been secured. The Dispatcher recommended the student also file a police report."
"230065","2023 02 14","1727","Temporary Exclusion","Campus",1676395620,"Notes: The director issued a temporary exclusion to a Reed alum based on continuing circumstances discussed in a prior report."
"230066","2023 02 14","1746","Suspicious Person/Activity/Circumstances","Grove Lot",1676396760,"Notes: A CSO on patrol in the Grove Lot encountered an individual looking through the recycling and garbage bins. Because the CSO had previously encountered the same individual doing the same thing on prior occasions, the CSO formally excluded the individual and escorted them off of campus."
"230068","2023 02 16","0019","Medical Assist - Other ","Residence Hall",1676506740,"Notes: CSOs responded to a request for medical assistance in a residence hall. They met with a student who had taken medications with possible contraindications. After discussing options with the student, the student opted to have emergency medical technicians respond for an evaluation. American Medical Response was contacted and the student was evaluated by emergency medical technicians. The technicians concluded that the symptoms the student was experiencing were not life-threatening and would resolve themselves over time. The student felt comfortable with this information and the CSOs cleared from the call."
"230069","2023 02 16","1411","Theft - Bike","Scholz Residence Hall",1676556660,"Notes: A CSO responded to a report of bike theft from Scholz residence hall. The CSO met with the bike owner who stated that they believed the bike had possibly been stolen during winter break. The bike had been secured with a bike lock, which the student found cut and lying on the floor. The CSO sympathized with the student and recommended they also file a police report."
"230071","2023 02 17","1505","Suspicious Person/Activity/Circumstances","West Lot",1676646300,"Notes: A CSO on foot patrol in the East Lot encountered a vehicle driving slowly up and down the rows of parking spaces. Having observed that the vehicle passed multiple available parking spaces, the CSO continued to observe the vehicle. The vehicle exited the lot and proceeded west on Woodstock Blvd. The CSO proceeded to the West Lot where they again encountered the same vehicle, driving slowly through the lot. The vehicle then left the lot and headed north on 28th Avenue. The CSO drove the CS vehicle through the middle of campus to the North lot, where, their suspicions confirmed, they again saw the vehicle driving through the lot. The vehicle had been parked and the driver was walking a small dog along the sidewalk. When another CSO intercepted the individual walking the dog, the individual stated that they had been waiting to pick up their sister and then became defensive when asked further questions. All CSOs have been advised of the vehicle and driver description in case they are seen on campus again."
"230072","2023 02 18","0256","Medical Assist - Alcohol","Residence Hall",1676688960,"Notes: A CSO responded to a request for assistance in a residence hall where it was reported that a student possibly required medical intervention. The CSO met with the student whom the report was regarding, and the student was coherent and did not exhibit signs of alcohol or other drug overdose. The CSO did provide the student with an escort back to their room and then cleared from the call."
"230073","2023 02 18","0635","Accident","Library",1676702100,"Notes: A CSO on vehicle patrol near the library accidentally hit a landscapng rock while maneuvering the vehicle through campus. Minor damage was caused to the bumper of the vehicle."
"230074","2023 02 18","1233","Theft - Bike","Scholz",1676723580,"Notes: A CSO responded to a report of bike theft from the Scholz residence hall.  The CSO met with a student who reported that they had last seen their bike on the eleventh, secured in the bike storage room in Scholz, and the morning of the report they found their bike lock cut and lying in the floor and the bike was missing. The CSO sympathized with the student and also recommended they file a report with the Portland Police Bureau."
"230075","2023 02 18","2321","Unattended Alcohol or Drugs","Student Union",1676762460,"Notes: A CSO responding to a noise complaint in the vicinity of the Student Union encountered unattended alcohol in the record storage room of the Student Union, where there was evidence of a gathering. The CSO disposed of the alcohol and continued on with their patrol priorities. "
"230050","2023 02 07","1305","Theft - Bike/Burglary/Clery Act Reportable Incident","Reed College Apartments",1675775100,"Notes: A CSO responded to a report of bike theft from a Reed College apartment. The CSO met with the bike owner and their housemate. The housemate stated that they had first noticed the bike was missing from inside the apartment, but assumed the owner had taken it out. When the bike owner returned home, they confirmed that they had not taken the bike anywhere. Both residents agreed that the unit had been locked during the time the bike went missing and no one else had permission to enter the apartment. The residents were unsure if the deadbolt had been secured and no visible signs of forced entry were observed."
"230051","2023 02 07","1846","Medical Transport - Other","Residence Hall",1675795560,"Notes: A CSO responded to a request for medical assistance at a residence hall. The CSO met with the residents, one of whom was experiencing a medical emergency and had already requested American Medical Response for transport. The CSO remained with the student until paramedics arrived and transported the student to a nearby medical facility for further care."
"230052","2023 02 10","1018","Evidence of Drug Use","Foster Residence Hall",1676024280,"Notes: A CSO on patrol in Foster residence hall encountered the diffuse odor of cannabis. The CSO was unable to locate the odor to a specific source."
"230053","2023 02 10","1039","Information Only","Eliot Circle",1676025540,"Notes: CSOs responded to a verbal altercation taking place in Eliot Circle. Upon arrival, the CSOs met with two delivery drivers who had been involved in a minor accident on Woodstock Blvd and had pulled off onto Eliot Drive to discuss the particulars. The drivers disagreed on the details of the accident, and had begun shouting at each other. One of the CSOs resumed their patrol priorities, while the other CSO remained on the scene to ensure the conflict was resolved peacefully."
"230054","2023 02 10","1103","Suspicious Person/Activity/Circumstances","GCC/Bookstore",1676026980,"Notes: A CSO responded to a report of an unknown individual potentially experiencing a mental health crisis in the bookstore. While en route to the bookstore, the CSO was notified that the individual had moved to the Great Lawn and was hiding underneath a tree. The CSO met with the reporting party not far from where the individual now was, and the reporting party provided the details as to why they were concerned for the individual. The CSO engaged with the individual, who was lying underneath a tree, and before the CSO was able to ascertain the individual’s situation, the individual apologized for being on campus and proceeded to head southward, off of campus. No further action was taken."
"230055","2023 02 10","1602","Damage to Property","Lower North Lot",1676044920,"Notes: A CSO responded to a report of a damaged vehicle in the Lower North Lot. The CSO met with the vehicle owner, a student, who reported that one of their vehicle tires had been slashed upwards of 20 times. The student did not have any idea who would have cause to damage the vehicle tire. The student had called AAA for assistance and the CSO also recommended that they file a police report."
"230056","2023 02 10","2156","Medical Assist - Other","Residence Hall",1676066160,"Notes: CSOs responded to a request for medical assistance at a residence hall. Upon arrival, they met with the reporting party who was concerned for their friend who was feeling unwell. After an evaluation and a recommendation from the On-Call area coordinator, paramedics were contacted to request a more thorough assessment. Ultimately, the student in distress declined medical transport, and the CSOs cleared from the call after the student showed signs of improvement."
"230057","2023 02 11","0854","Theft of Vehicle/Clery Act Reportable Incident","28 West",1676105640,"Notes: A student arrived at 28 West to report that their vehicle had been stolen from the lot behind 28 West. This vehicle had been involved in multiple prior reports regarding damage and attempted theft. The CSO sympathized with the vehicle owner and recommended they also file a report with the Portland Police Department. "
"230059","2023 02 11","1932","Exclusion","Student Union",1676143920,"Notes: CSOs responded to a report of an unknown individual smoking cigarettes in the Student Union. Upon arrival, the CSOs encountered a previously excluded individual smoking cigarettes in the north loft. The CSOs escorted the individual off campus without incident."
"230060","2023 02 12","1237","Theft from Vehicle","West Lot",1676205420,"Notes: A student arrived at 28 West to report that two days prior, while their vehicle had been parked in the West Lot, the vehicle rear door window had been smashed, and the surrounding door frame had been damaged, in a break-in. The student reported that nothing of significant value had been stolen."
"230041","2023 01 30","1652","No Contact Order","Campus",1675097520,"Notes: A No Contact Order was put in place at the request of the Title IX Coordinator."
"230042","2023 01 31","1732","Suspicious Person/Activity/Circumstances","Canyon",1675186320,"Notes: A CSO on patrol encountered a known houseless individual carrying a bag of cans through campus. The CSO reminded the individual that looking through garbage on campus is not allowed and the individual began walking northward toward the Steele Street campus perimeter. As the individual did so, they let go of their dog’s leash, allowing it to wander freely. When the CSO reminded the individual of the campus leash policy, the individual ignored the CSO, so the CSO verbally excluded the individual at that time. The CSO continued to escort the individual until they had exited campus."
