"Case#","Date","Time","Description","Location","Date_Time","Notes"
"220044","2022 02 08","1706","Found Property/Camping","Growing Seeds Child Care",1644339960,"Notes: A Dispatcher on break encountered a rolled up tent underneath a tree near the Growing Seeds duck pond. When the Dispatcher unrolled the tent they saw what appeared to be a medium sized tackle box. The box was labeled “Thorne Research Test Kit” and upon opening the box, the Dispatcher saw multiple amber vials containing what looked like pills. Each vial was labeled with a periodic element type abbreviation. The Dispatcher requested CSO assistance. A CSO wearing nitrile gloves arrived and secured the box for transfer back to 28 West. Photos of the box were sent in an email to the science department in an attempt to locate the owner of the box. "
"220045","2022 02 10","0533","Information Only","28 West",1644471180,"Notes: A student reported that they encountered illegal illicit content while online. The student reported the site to a federal website and the local police department."
"220046","2022 02 10","1603","No Contact Order","Campus",1644508980,"Notes: A student arrived at 28 West to request a No Contact Order in response to a prior reported incident."
"220047","2022 02 10","1718","Stalking","Off Campus",1644513480,"Notes: A student reported a stalking situation they had experienced off campus and wanted Community Safety to be aware should the individual come to campus to look for the student."
"220048","2022 02 10","2150","Damage to Property","Eliot Hall",1644529800,"Notes: A student reported that their roommate’s bike had sustained damage that appeared to be consistent with attempted theft. The bike had been secured outside of Vollum and when the student checked on the bike they observed that the left handle had been bent, the frame had been bent, and the frame was cut in two different areas. The lock securing the bike appeared to also have sustained damage."
"220049","2022 02 11","2238","Damage to Property","Chinese House",1644619080,"Notes: A student reported new damage to the window of their residence in Chinese House. The student expressed concern that the damage was due to an attempted break-in. CSOs performed extra patrols in the southeast quadrant that evening but did not observe any suspicious activity."
"220027","2022 01 31","1046","No Contact Order Violation / Information Only","Campus",1643625960,"Notes: A possible no contact order violation was reported. Evaluation determined that no violation took place."
"220029","2022 02 01","1310","Damage to Property","Chemistry",1643721000,"Notes: A CSO resuming vehicle patrol accidentally bumped a garbage receptacle with the back bumper of the Subaru, causing a small scratch to the Subaru bumper and no new visible damage to the garbage receptacle. "
"220030","2022 02 01","1330","Fire","Winch/Capehart",1643722200,"Notes: A CSO responded to a fire alarm at a Winch residence. The CSO met with the occupant of the room who stated that they had attempted to use the fireplace in their residence to stay warm. The CSO relayed that per the guidelines regarding igniting fires of any kind in residence halls, most likely any fireplaces in the building had been rendered inoperable. The CSO recommended the student speak to their Area Coordinator if they had further questions regarding the guidelines or fireplace usage, then reset the alarm and cleared from the call. "
"220031","2022 02 02","1553","Information Only","28 West",1643817180,"Notes: A student arrived at 28 West to report that another student had sold illicit drugs on campus."
"220032","2022 02 03","0843","Theft - Other","North Lot",1643877780,"Notes: A CSO responded to a theft report in the North Lot. Upon arrival, the CSO observed that the vehicle described in the report had its gas tank door open and the gas cap was lying on the ground nearby. When the CSO conducted a detailed inspection of other vehicles in the area, two more vehicles were found to have their gas tank doors open and their gas caps removed. Only one of the three vehicles was registered with Community Safety and that vehicle owner was contacted regarding the tampering and possible removal of the vehicle’s gas. As a result of this incident, all other Reed parking lots were patrolled and it was determined that no other vehicles had been visibly tampered with as far as the CSOs were able to observe. "
"220033","2022 02 03","1644","Harassment","28 West",1643906640,"Notes: Two students arrived at 28 West to report their harassment by another Reed student. "
"220035","2022 02 04","0921","Exclusion","Campus",1643966460,"Notes: Administrative action was taken regarding a No Contact Order.  "
"220036","2022 02 04","1931","Evidence of Drug Use","Chittick",1644003060,"Notes: A CSO on patrol encountered an unattended prescription medication bottle on the picnic table inside the smoke shack between Chittick and Woodbridge. The bottle did not contain any medication, but did appear to contain cannabis residue. The CSO disposed of the bottle and continued on their patrol."
"220037","2022 02 04","2322","Evidence of Drug Use","MacNaughton",1644016920,"Notes: A CSO responded to a report of cannabis use in MacNaughton residence hall. Upon arrival, the CSO encountered the odor of cannabis and met with the reporting party who stated that the use of cannabis inside the residence hall was a common occurrence and that they wished it would not be. The CSO was unable to determine the source of the odor of cannabis use as the odor permeated the entire first floor.  "
"220038","2022 02 05","0156","Stegophily, Public Health Behavior","Library",1644026160,"Notes: A CSO on patrol of the library encountered an open window known to provide access to the library roof so the CSO initiated a roof inspection. Once on the roof, the CSO encountered two individuals, one was a Reed student and the other was not. The CSO explained that the library is currently closed to the public due to the college’s COVID restrictions, and access to the roof is restricted. The CSO informed the student that they and their company would need to leave. The student was apologetic and stated that they had just been looking for a quiet place to paint. The student packed up their art supplies and the CSO escorted the Reed student and their friend down off of the roof and out of the library."
"220039","2022 02 05","0514","Unattended Alcohol or Drugs","Russian House",1644038040,"Notes: A CSO ensuring door security while on exterior patrol of the Language houses observed multiple bottles of beer sitting in open view and unattended inside the Russian house common room. When the CSO entered the building to confiscate the unattended alcohol they also observed that a glass pipe containing cannabis residue had been left sitting on the table. The CSO disposed of the remaining alcohol and cannabis, and replaced the pipe back where it had been left. "
"220040","2022 02 06","1353","Damage to Property","Upper North Lot",1644155580,"Notes: A CSO responded to a potential theft in the Upper North Lot. Upon arrival, the CSO met with a student who stated that they feared their catalytic converter had been stolen based on the sound their vehicle made upon ignition. When the CSO looked underneath the vehicle to confirm the removal of the catalytic converter, they observed that the exhaust pipe had been cut but that the catalytic converter was still intact."
"220041","2022 02 06","2133","Medical Transport - Drug/Health Behavior/Use of Force","Residence Hall",1644183180,"Notes: CSOs responded to a report from other students of a student experiencing medical distress. After evaluating the student, the CSOs requested Emergency Medical Services (EMS) for further evaluation and care at a nearby medical facility. The CSOs cleared from the call once American Medical Response had transported the student off of campus. "
"220024","2022 01 26","1206","Theft - Bike","Scholz",1643198760,"Notes: A student arrived at 28 West to report the theft of their bike. The bike had last been seen secured inside the Scholze bike storage room. When the student returned to retrieve the bike, it and the lock were missing. The bike is a black Trek Verve 2. The CSO sympathized with the student’s loss and let them know the report would be available should the student need it."
"220026","2022 01 29","1249","Damage to Property","Upper North Lot",1643460540,"Notes: A CSO responded to a report of catalytic converter theft. The CSO met a student in the North Lot near the student’s vehicle. The student reported that they believed their catalytic converter was missing. The CSO moved to visibly confirm the theft and observed that the catalytic converter was still intact, but the exhaust pipe had been cut in an attempt to remove the part. The CSO recommended the student have a catalytic converter theft deterrent part installed when they took the vehicle in for the exhaust pipe repair. The student was grateful for the help and the CSO cleared from the call."
"220012","2022 01 17","2134","Theft - Other","GCC",1642455240,"Notes: While on patrol near the GCC, a CSO was flagged down by a student wanting to report a theft of personal property. The student reported that their prescription eyeglasses were stolen out of the Pool Hall in the GCC approximately 1.5 hours prior. The student also stated that other students had recently had items stolen from inside the Pool Hall. The CSO sympathized with the student and stated that the student should check back with Dispatch to see if the glasses had been recovered or turned in. "
"220013","2022 01 20","1533","Theft - Bike","Scholz",1642692780,"Notes: A student arrived at 28 West to report that their bike had been stolen. The student reported that they had last seen their bike before leaving for winter break and when they returned to check on the bike in the Scholz bike storage room, the bike was missing and their cut bike lock was lying on the floor. The bike is described as a blue black Trek 820."
"220014","2022 01 20","2113","Candle or incense burning in a residence hall","Scholz",1642713180,"Notes: A CSO responded to a fire alarm in Scholz. When the CSO arrived at the room which had caused the alarm to trigger, they spoke with a resident who stated that they had lit a candle, causing the alarm to sound. The student had already extinguished the candle."
"220016","2022 01 20","2337","Candle or incense burning in residence hall","MacNaughton",1642721820,"Notes: A CSO on exterior patrol of MacNaughton observed, via an open residence window, three lit candles. The CSO initiated contact with the resident who apologized and extinguished the candles. The CSO reminded the student of the candle and incense policy before returning to their patrol. "
"220017","2022 01 21","0138","Exclusion","Birchwood Apartments",1642729080,"Notes: A CSO responded to a report of a suspicious person at one of the Birchwood apartment patios. The CSO initiated contact with the individual who stated that they were just passing by, and after confirming that they did not have any official business on the property, the CSO requested the individual leave the premises. The individual apologized and complied. While insuring that the individual had left the property, the CSO again sighted the individual in an unlit area near a north corner of the apartments. The CSO again approached the individual and requested they leave the property. The individual stated that it hadn’t been made clear to them that they “needed to leave now.” The CSO clarified that point and again requested the individual leave. The individual headed east on Steele Street and the CSO cleared from the area. While finishing a call in the Steele Lot, the CSO again spotted the individual from the prior interaction. The CSO turned their vehicle around to intercept the individual, who then jumped into the Reed property bushes near the Growing Seeds child care center. The CSO made contact with the individual, who stated that they had been urinating. The CSO issued a verbal exclusion to the individual at that time. The individual agreed to leave the property and headed eastward on Steele St. CSOs remained in the general area to ensure that the individual left. A few minutes later, the other CSO on shift encountered the individual walking westward on Steele St. The individual approached the CSO and stated that their vehicle was parked near the fruit stand on 28th Ave and they were headed to retrieve it. CSOs maintained visual contact with the individual until they entered their vehicle and left the area at a high rate of speed, failing to stop at a stop sign. A CS Manager contacted Portland Police to notify them of the safety concerns regarding the driving behavior of the individual. "
"220018","2022 01 21","0634","Suspicious Person/Activity/Circumstances, Damage to Property","West Lot",1642746840,"Notes: A CSO on patrol in the West Lot encountered a vehicle with its gas tank door open and the gas cap lying on the ground nearby. When the CSO approached the vehicle, they also observed that the driver side door was slightly ajar. The CSO also noted that the steering wheel had been cut and the steering wheel locking mechanism was lying on the passenger seat. The electrical panel of the vehicle also appeared to have been pried open and tampered with. The vehicle is registered with Community Safety and the owner was successfully contacted regarding the damage and tampering. "
"220019","2022 01 21","2131","Suspicious Person/Activities/Circumstances","Botsford Drive",1642800660,"Notes: A CSO on vehicle patrol was driving east on Botsford Drive when they were flagged down by a Reed staff member who pointed out that a Reed owned van had its gas tank door open. The CSO observed that the gas tank door does not lock and could easily have been opened by anyone. There appeared to be no other signs of tampering. The CSO inspected other nearby Reed vehicles and did not see any other signs of suspicious activity. "
"220020","2022 01 22","1505","Evidence of Drug Use","28 West",1642863900,"Notes: A CSO on a vehicle inspection encountered what appeared to be a used hypodermic syringe lying in the bushes directly in front of the vehicle. The CSO used the proper equipment to safely dispose of the syringe. "
"220021","2022 01 23","0202","Evidence of Drug Use","Bragdon Hall",1642903320,"Notes: A CSO entering Bragdon residence hall immediately encountered the odor of cannabis in the common area. The CSO was unable to determine the exact source of the odor. "
"220022","2022 01 23","1625","Damage to Property","GCC",1642955100,"Notes: A CSO responded to a request to meet with a Reed staff member near the bike racks on the west side of the GCC. The staff member reported that a co-worker had observed two individuals behaving suspiciously at the bike racks and had approached them. The two individuals quickly ran from the area and left in a blue SUV. The co-worker informed the reporting staff member of the incident, who discovered that their bike, which had been secured at that bike rack, had received extensive damage to its frame and one of the tires. The bike lock had also been cut. The CSO stored the bike in the Community Safety bike storage until the staff member could transport it home, as the damage done had rendered it unrideable. "
"220023","2022 01 23","2221","Evidence of Drug Use","Sullivan Hall",1642976460,"Notes: A CSO responded to a report of the odor of cannabis in Sullivan Hall. The CSO met with the reporting party who stated that the odor of cannabis had been entering their room off and on for at least a couple of months. The resident had previously reported the odor and had been told that the odor was traveling through the heater from another floor. The CSO inspected the heater and put in a request for this to be looked into further by building services. The CSO did not note any odor of cannabis while speaking with the resident or investigating the possible source. "
"220005","2022 01 12","0051","Damage to Property","West Lot",1641948660,"Notes: A CSO responded to a request for vehicle assistance in the West Lot. Upon arrival the CSO met with the vehicle owner, a Reed employee, who stated that they had heard unusual noises upon starting the vehicle. The employee checked beneath their vehicle and observed that cuts had been made to the pipes leading to their catalytic converter, but that the catalytic converter was still in place. The CSO completed a report and returned to their patrol duties."
"220006","2022 01 13","0910","No Contact Order","Campus",1642065000,"Notes: At the request of the Title IX Coordinator, a No Contact Order was put in place."
"220007","2022 01 13","1537","Graffiti","Eliot Circle",1642088220,"Notes: A CSO on patrol encountered new graffiti on a metal box to the southeast of Eliot Hall. Building Services has been contacted for clean up."
"220008","2022 01 14","0028","Information Only","Campus",1642120080,"Notes: A CSO on patrol encountered an unauthorized vehicle driving on the sidewalk south of Eliot Hall. When the CSO attempted to make contact with the driver by flashing their flashlight at the ground, the driver accelerated the vehicle and drove past the CSO, coming within inches of striking the CSO with the vehicle. A member of the Reed custodial staff, who also witnessed the vehicle driving on the path, caught the driver’s attention. The driver stopped momentarily, then drove off of campus after briefly speaking with the staff member. The CSO again encountered the vehicle approximately two hours later while on vehicle patrol. The vehicle appeared to be headed toward the West Lot so the CSO followed at a safe distance. The vehicle’s driver performed a U-turn after noting that the CSO was following them. The CSO continued to follow the vehicle, which performed a second U-turn then left the Reed campus area at a high rate of speed. The vehicle was not sighted again."
"220009","2022 01 14","1254","Information Only","Campus",1642164840,"Notes: Staff reported concerns related to a Judicial Board Hearing. No action was required."
"220010","2022 01 15","0028","Unattended Alcohol or Drugs","Student Union",1642206480,"Notes: CSOs responded to a report of unattended alcohol in the Student Union. Upon arrival, the CSOs noted multiple unattended and unsecured kegs containing alcohol. Beer Nation was contacted and came to secure the kegs. "
"220011","2022 01 15","1626","Graffiti","Front Lawn",1642263960,"Notes: A CSO on patrol encountered new graffiti on three of the red lounge chairs located on the Front Lawn. Building Services was contacted for clean up."
"220001","2022 01 03","1513","Damage to Property","Naito Hall",1641222780,"Notes: A CSO on patrol encountered a damaged “EXIT” sign in the north hallway of the Naito hall first floor common room. Building Services has been contacted for repairs. "
"220002","2022 01 03","2338","Medical Assist - Other","Residence Hall",1641253080,"Notes: A CSO responded to a request for medical assistance for a student. The CSO spoke with the student regarding a course of action and the student was appreciative."
"220003","2022 01 04","1324","Medical Assist - Other","Residence Hall",1641302640,"Notes: A CSO on patrol encountered a student who reported that a fellow student was possibly experiencing medical distress. The CSO met with the reporting student and their fellow student and recommended a course of action."
"220004","2022 01 07","1723","Damage to Property","West Lot",1641576180,"Notes: A CSO on patrol in the West Lot encountered a vehicle with a shattered passenger side window. Glass was on the ground near the vehicle and inside the vehicle. The CSO was unable to determine whether or not there were any items missing from the vehicle. This vehicle is not registered with Community Safety so contact with the owner was unable to be made."
"210555","2021 12 28","0243","Graffiti","Library",1640659380,"Notes: A CSO on patrol in the library encountered new graffiti in a restroom. Building Services has been contacted for removal of the graffiti."
"210556","2021 12 31","1522","Information Only","Northwest Quadrant",1640964120,"Notes: A CSO on patrol encountered wires that had been partially pulled up out of the ground and cut in the field to the east of the childcare building. Maintenance was able to determine that the wiring was old and inactive. "
"210553","2021 12 25","1357","Unauthorized Entry","Canyon House",1640440620,"Notes: CSOs on patrol encountered an unknown vehicle parked in the driveway to the Canyon House. The CSOs completed an exterior patrol and as they were about to begin an interior patrol, two unknown individuals exited the building through the front door. When the CSOs asked the individuals their business at that location, one of them stated that they had seen some “bad guys” and wanted to stop them. They stated that the “bad guys” had gone into the canyon. One of the CSOs stated that the individuals were trespassing on private property and the police had already been called. The two individuals quickly entered their vehicle and left the premises. After the individuals had left, the CSOs completed an interior patrol of the building and did not find anything amiss. It appeared that the break-in had just occurred. The CSOs secured the building and continued on their patrols. "
"210554","2021 12 25","2220","Accident/Damage to Property","Greywood",1640470800,"Notes: A CSO on patrol near Greywood was notified of a car crash that had taken place nearby. The CSO arrived at the scene of the accident just off of SE Woodstock Blvd, on the Reed campus grounds near Greywood. A vehicle had careened off of the street, past the sidewalk, and had hit a redwood tree on campus. There was already a crowd of bystanders gathered when the CSO arrived, and the CSO was notified that 911 had already been called. The 911 Dispatcher had provided instructions that the driver of the vehicle not be removed from the vehicle. The CSO remained on the scene until American Medical Response arrived and successfully extracted the driver from the vehicle. The CSO was able to learn from Portland Police that the driver was not affiliated with the college."
"210537","2021 12 13","1342","Harassment","Student Union",1639402920,"Notes: A report of student harassment was received."
"210538","2021 12 13","1435","Information Only","Off Campus",1639406100,"Notes: A professor reported receiving disconcerting emails from a former student."
"210539","2021 12 13","2346","Information Only","GCC",1639439160,"Notes: A CSO on patrol encountered derogatory flyers and graffiti in the GCC and Student Union targeting an individual. The flyers were removed and Building Services was contacted for removal of the graffiti."
"210540","2021 12 14","1340","Harassment","28 West",1639489200,"Notes: A student requested a No Contact Order."
"210541","2021 12 14","2223","Medical Assist - Other","Residence Hall",1639520580,"Notes: CSOs responded to a request for medical assistance in a residence hall by a student experiencing pain. The CSOs recommended the student talk to a medical professional. The student spoke to the Fonemed nurse who advised the student to be seen at a nearby medical facility. The student arranged for a ride to a nearby facility for further evaluation."
"210542","2021 12 15","0131","Evidence of Drug Use","Student Union",1639531860,"Notes: A CSO on patrol at the Student Union encountered the odor of cannabis upon entering the building. The CSO heard people on the south balcony, and a group of three people then came down the stairs. The CSO asked if any of them had smoked cannabis, to which one replied, “one of us was.” The individuals declined to speak with the CSO, identify themselves, or provide Reed ID cards. The CSO again requested their cooperation but they continued to walk away."
"210543","2021 12 15","0215","Medical Transport - Other","Residence Hall",1639534500,"Notes: Dispatch received a call from a student experiencing a medical emergency. The student did not want American Medical Response (AMR) contacted or a CSO dispatched. The Dispatcher recommended the student contact the nurse Fonemed line for further medical assistance, which the student did. Approximately an hour later, the student again contacted Dispatch and reported that, per the Fonemed nurse, the student needed to be evaluated at a nearby medical facility. The Dispatcher contacted Radio cab to arrange for the student to be transported to a nearby medical facility. "
"210544","2021 12 15","0930","Stalking","Off Campus",1639560600,"Notes: A student reported an incident of stalking that occurred off campus and wanted Community Safety to be aware of the situation. "
"210545","2021 12 15","1308","No Contact Order","Campus",1639573680,"Notes: No Contact Orders were put in place due to reports of unwanted contact."
"210546","2021 12 15","1403","Student Concern","28 West",1639576980,"Notes: A student arrived at 28 West to express concern for the welfare of a fellow student. Community Safety and the Dean of Students are following up on this matter."
"210547","2021 12 16","1144","Graffiti","GCC",1639655040,"Notes: A CSO on patrol encountered graffiti in the lower level GCC bathrooms that targeted multiple people. Building services has been contacted for removal of the graffiti."
"210548","2021 12 16","2116","Medical Assist - Other","Residence Hall",1639689360,"Notes: A CSO responded to a request for medical assistance at a residence hall. Upon arrival, the CSO met with the student requiring assistance. The student had received an injury, and after evaluation, the CSO agreed with the student that the student should be treated at a nearby medical facility. The student arranged for their own transportation and declined further medical assistance offered by the CSO. "
