"Case#","Date","Time","Description","Location","Date_Time","Notes"
"220225","2022 06 19","1236","Suspicious Person/Activity/Circumstances/Theft from Vehicle ","Grove Lot",1655642160,"Notes: A CSO responded to a report of an attempted theft from a vehicle in the Grove Lot. The CSO met with the owner of the vehicle who stated that their catalytic converter had been tampered with, the pipe having been cut from the front portion and bolts had been removed from the back portion. The CSO stated that earlier on their shift they had responded to a suspicious person call in the same location of their vehicle, but didn’t witness any suspicious activity. The CSO had observed an individual get into a vehicle and drive away, but that was all. "
"220220","2022 06 08","1405","Fire","Greenwood",1654697100,"Notes: A CSO responded to a report of a fire near Greywood. The CSO observed upon arrival that the fire, located on the sidewalk near Greywood bordering Woodstock Blvd., had been extinguished by a Reed staff member. The CSO confirmed that the fire was fully extinguished and replaced the discharged extinguisher. "
"220221","2022 06 12","1128","Theft of Motor Vehicle","Prexy",1655033280,"Notes: A CSO responded to a report of a property dispute. Upon arrival, the CSO met with a Reed staff member and a juvenile who stated that they were there for Reunions with their alum parent. The juvenile guest stated that they had been driving the Reed electric carts while assisting Meat Smoke with deliveries. The Reed staff member stated that the guest did not have permission to use the electric carts and, without approval, had driven multiple carts over the course of the weekend. The guest had an electric cart key which they were initially hesitant to hand to the CSO, but they did end up turning it over.  "
"220217","2022 05 31","1759","Suspicious person/activity/circumstances","Trillium",1654019940,"Notes: A CSO responded to a report of a student streaking naked on the Sports Field, and also streaking on the Trillium fourth floor balcony, several hours earlier. The reporter stated that they believed the streaking student had ingested lysergic acid diethylamide. The CSOs did not encounter any naked students during their patrols."
"220218","2022 06 01","1553","Suspicious person/activity/circumstances","Trillium",1654098780,"Notes: A CSO on an exterior patrol of Trillium encountered a cut bike on the east side of the building. "
"220219","2022 06 03","2224","Evidence of Drug Use","Trillium",1654295040,"Notes: A CSO on internal patrol of Trillium encountered an empty cannabis container left on the fourth floor balcony."
"220215","2022 05 24","1354","Information Only","GCC",1653400440,"Notes: A CSO on patrol near GCC observed an individual remove a bike from the GCC bike rack, and then attempted to ride one bike and tow the other by holding on to it. The CSO was familiar with the bike the individual was towing, and when the CSO attempted to ask the individual about the bike, the individual cursed at the CSO and shoved the bike they had removed from the rack in the CSO’s direction, then rode off. The CSO placed the bicycle in the 28 West secure bike storage.  "
"220216","2022 05 26","1959","Evidence of Drug Use","Trillium",1653595140,"Notes: A CSO on patrol in Trillium encountered a cannabis joint left on the fourth floor balcony table. The CSO disposed of the cannabis joint and continued on their patrol."
"220206 ","2022 05 16","0725","Burglary","Gray Campus Center (GCC)",1652685900,"Notes: A CSO responded to the GCC to take a report of burglary. The CSO met with a Bon Appetit employee who reported that when they had arrived on site they observed multiple food items strewn about the kitchen area, and beverages and food stolen. Shortly after taking this report, a Reed building services member reported to the CSO that a door to the Student Union (SU) had been broken and there was damage inside the building. The CSO inspected the door and found damage consistent with that caused by forced entry. When the CSO entered the SU, they observed that a fire extinguisher had been discharged, a disco ball had been shattered, and multiple commencement gowns and mortarboards had been removed from their storage areas. The CSO found the missing commencement gowns, along with food from Commons, hidden underneath a chair."
"220208","2022 05 16","1306","Medical Transport - Other","Residence Hall",1652706360,"Notes: A CSO responded to a request for medical assistance at a residence hall. Upon arrival, the CSO met with a student experiencing medical distress. The student opted to be treated at a medical facility. American Medical Response (AMR) was activated and transported the student to a nearby medical facility for care."
"220209","2022 05 17","0915","Unattended Alcohol or Drugs","Pool Hall",1652778900,"Notes: A CSO performing a move-out walk through encountered an alcoholic beverage inside the Pool Hall manager’s office. As not all people with access to that area are of legal drinking age, the CSO disposed of the alcohol."
"220210","2022 05 17","1008","Evidence of Drug Use/Smoking Violation-Dorm","Trillium",1652782080,"Notes: A CSO performing a move-out walk through encountered extensive evidence of both tobacco and cannabis use on the Trillium fourth floor balcony."
"220211","2022 05 18","0514","Theft from Vehicle","North Lot",1652850840,"Notes: A student arrived at 28 West to report that they had been in their vehicle when an unknown individual broke the front passenger window and took the student’s backpack from off of the passenger seat. The individual then got into a black sedan and drove away."
"220213","2022 05 21","1648","Maintenance Issue","Aspen",1653151680,"Notes: A CSO was dispatched to Aspen where a student had reported they were stuck in the building elevator. The CSO confirmed with the student that they were okay and requested Portland Fire Department (PFD) response to assist in opening the elevator door. PFD successfully opened the door and retrieved the student. The CSO taped off the elevator and put in a work order with building maintenance."
"220214","2022 05 22","1053","Damage to Property","28 West",1653216780,"Notes: A CSO exiting the CS Honda heard a loud hissing noise coming from the front driver’s side tire and observed that the tire was deflating. A work order was put in for repairs."
"220201","2022 05 10","1450","Damage to Property","Grove Dorms",1652194200,"Notes: A CSO on patrol near the Grove dorms observed new lawn damage east of Sequoia. The damage was consistent with that done by vehicle tires. Grounds has been contacted for repairs."
"220202","2022 05 10","1759","Graffiti","Vollum",1652205540,"Notes: A CSO on patrol encountered new graffiti on a power generator east of Vollum. Building Services has been contacted for removal of the graffiti."
"220203","2022 05 11","1821","Damage to Property/Theft-Computer/Theft from Vehicle","Upper North Lot",1652293260,"Notes: A CSO responded to a report of a vehicle break-in in the Upper North parking lot. Upon arrival, the CSO met with a student who stated that their laptop and other personal belongings had been stolen. The vehicle owner arrived, another Reed student,  and confirmed that some of their personal belongings had also been stolen. The CSO sympathized with the students and recommended they file police reports."
"220204","2022 05 12","0144","Theft - Other","Biology",1652319840,"Notes: A CSO responded to a report of theft from a bike parked at the Biology/Physics breezeway. Upon arrival, the CSO met with the bike owner who reported that a saddlebag containing bike related items had been stolen off of their bike. "
"220205","2022 05 15","0849","Evidence of Drug Use","Russian House",1652604540,"Notes: A CSO on exterior patrol of the Language houses observed through a window, clearly marked cannabis containers and cannabis paraphernalia left unattended on the common room table. The CSO entered the building and confiscated the containers and paraphernalia containing cannabis, leaving a “CSO was here” card. "
"220197","2022 05 04","1718","Disturbance","East Lot",1651684680,"Notes: A CSO responded to a report of a disturbance in the East Lot. A staff member/alum reported a hostile encounter with a student that reportedly included the student insulting and spitting on the staff member and their vehicle. The report will be referred to appropriate college staff for follow up."
"220198","2022 05 05","0921","Temporary Exclusion","Campus",1651742460,"Notes: A limited scope exclusion was issued to a Reed student."
"220199","2022 05 05","0945","No Contact Order","Campus",1651743900,"Notes: A No Contact Order was put in place between Reed community members."
"220200","2022 05 07","0023","Medical Assist/Alcohol Violation//Medical Amnesty","Residence Hall",1651882980,"Notes: CSOs responded to a report of an intoxicated student requiring assistance. The CSOs arrived to find the student conscious but displaying symptoms of possible alcohol overdose. After evaluating the student based on information on the yellow “Signs of alcohol or other drug overdose emergencies” card, CSO determined that medical transport was not necessary. The student was left in the company of friends with instructions to call if the student’s condition worsened."
"220170","2022 04 27","2107","Maintenance Issue","Aspen",1651093620,"Notes: A CSO responded to a report of an inoperable elevator with a student stuck inside. The CSO arrived and confirmed that the elevator would not open and requested Portland Fire respond to assist. Portland Fire eventually freed the student and recommended elevator maintenance. The elevator was signed as out of order. "
"220171","2022 04 28","0418","Trespass/Exclusion","Residence Hall",1651119480,"Notes: A CSO on patrol encountered an excluded individual on campus. The CSO escorted the individual off of campus and informed them that Portland Police would be called if they were seen on campus again."
"220172","2022 04 29","0233","Suspicious Person/Activity/Circumstances","North Lot",1651199580,"Notes: A CSO on patrol encountered a vehicle parked diagonally across parking spaces. After determining that the vehicle did not belong to a Reed community member the officer issued a 72 hour tow notice for the vehicle if it was not reparked in a correct manner. "
"220173","2022 04 29","0841","Medical Transport - Other","Residence Hall",1651221660,"Notes: A CSO responded to a request for medical assistance in a residence hall. The CSO met with the student and leaned that they had called EMS on their own. The student was eventually transported to a medical facility for care. "
"220174","2022 04 29","1326","Suspicious Person/Activity/Circumstances","North Lot",1651238760,"Notes: A CSO responded to a report of an argument taking place in the North Lot. CSO found a Reed community member and a visitor shouting at each other. A second CSO arrived and the parties were separated and interviewed individually. The visitor acknowledged having tried to force the community member to turn down music in their car, resulting in the argument. The visitor was reminded that they are on campus as guest only and should call Community Safety with any concerns."
"220181","2022 04 29","1735","Alcohol Violation","Front Lawn",1651253700,"Notes: A CSO on patrol observed an unknown individual pour a liquid from a bottle marked that it contained alcohol into a plastic cup and hand it to another individual who then passed the first individual money. The CSO approached, and the individual who had just made a purchase confirmed that they had just bought some alcohol from the other individual. Both individuals confirmed that they were Reed alumni. When the CSO informed the individual selling alcohol on campus was not allowed they stated that they were unaware of this. This same individual had been reported a few minutes prior for possibly acting inappropriately with students. The CSO requested the alum leave campus and escorted them to their vehicle. When at their vehicle, the alum stated that they were unable to locate their keys. The alum ended up calling an acquaintance to pick them up and left campus.  "
"220184","2022 04 30","0943","Evidence of Drug Use","Student Union",1651311780,"Notes: A CSO on patrol in the Student Union encountered unattended cannabis and psilocybin mushrooms in the Student Union. The CSO collected and disposed of the items."
"220185","2022 04 30","1336","Unattended Alcohol or Drugs","ODB/Sally Port",1651325760,"Notes: A CSO on patrol in central campus encountered a plastic easter egg in the ODB sally port. Based on the CSO’s previous Renn Fayre experience, they opened the easter egg and discovered that it contained a cannabis edible. The CSO disposed of the easter egg and alerted the CS team of the presence so that any further easter eggs discovered could be disposed of properly. "
"220187","2022 04 30","1354","Unattended Alcohol or Drugs","Front Lawn",1651326840,"Notes: A CSO on patrol of the front lawn encountered an easter egg containing a cannabis joint. The CSO disposed of the joint. Additional easter eggs were found by CSOs on the front lawn and also disposed of properly. "
"220190","2022 04 30","2312","Evidence of Drug Use","Gray Campus Center",1651360320,"Notes: A CSO on patrol in the GCC encountered a student who appeared to hide a whipped cream canister as the CSO approached. Given the behavior of the student and the sound of metal jingling in the student’s shoulder bag, a sound commonly associated with nitrous oxide canisters jostling together, the CSO initiated contact with the student. The student confirmed that they were in possession of whippets and remanded the canisters to the CSO. The CSO disposed of the canisters and continued on their patrol."
"220192","2022 04 30","2333","Suspicious Person/Activity/Circumstances","East Lot",1651361580,"Notes: CSOs on patrol encountered an individual yelling in the East Lot. The CSOs were approached by a member of Meat Smoke who informed them that they had been trying to calm the individual down but the individual had grown increasingly agitated. As the CSOs interacted with the agitated individual it became apparent that the individual was experiencing a psychological crisis. The CSOs contacted White Bird who responded and took over the interaction with the individual. The CS Director accompanied White Bird as they helped the person to their tent. White Bird tended to the person who was eventually (the following morning) able to leave with a friend."
"220193","2022 04 30","2349","Evidence of Drug Use","Central Campus",1651362540,"Notes: After a smoke machine had triggered the fire alarm in the GCC, the CS director was opening doors and windows to clear the smoke when they encountered two students exiting the print shop and the odor of cannabis was prominent. The director did not interact with the students at the time as the priority was the triggered alarm and smoke in the building, but later returned to the room and confirmed that the odor of cannabis was strongest in that room."
"220194","2022 05 01 ","0139","Suspicious Person/Activity/Circumstances","Dorothy Johansen House",1651369140,"Notes: A CSO responded to a report of an excluded alum being on campus. The CSO met with a member of Meat Smoke who confirmed seeing the alum. The excluded alum left campus after members of Meat Smoke told them to leave."
"220195","2022 05 01","1000","Evidence of Drug Use","Paradox Cafe",1651399200,"Notes: A CSO on patrol in central campus observed multiple whippet cartridges and various alcohol containers sitting in plain view inside the Paradox cafe. The CSO entered the cafe and collected all drug paraphernalia and alcohol containers. The CSO also encountered a note left by a student requesting that people venmo them for the whippets. The report was referred to the CS Director and the Office of Student Engagement for follow up."
"220196","2022 05 01","1952","Theft from Vehicle","West Lot",1651434720,"Notes: A CSO on patrol in the West Lot encountered a parked vehicle with a shattered passenger side window. As the CSO approached, they observed that the vehicle was occupied and the occupant began waving them over. The occupant confirmed that they were the vehicle owner and they had just returned to the vehicle to discover the broken window. They also reported that a small bag of personal belongings had been taken. The CSO advised them to file a police report."
"220146","2022 04 18","0923","Damage to Property","Sitka Residence Hall",1650273780,"Notes: A CSO on patrol observed that a Sitka patio door had been closed improperly in a manner which left it unsecured. The CSO secured the door and continued on their patrols. "
"220147","2022 04 20","1356","Bias-Related Incident","Campus",1650462960,"Notes: Racially biased comments were made anonymously during a Zoom workshop. This incident is being investigated by Reed’s Office of Institutional Diversity (OID)."
"220148","2022 04 20","1455","Medical Transport - Other","Residence Hall",1650466500,"Notes: CSOs responded to a request for medical assistance in a residence hall. Upon arrival, the CSOs met with two students, one of whom was experiencing a medical emergency. After assessing the student and discussing options, the CSOs requested American Medical Response (AMR) be dispatched. The CSOs remained with the student until AMR transported the student to a nearby medical facility for further care."
"220150","2022 04 21","0151","Medical Transport - Other","Eliot Circle",1650505860,"Notes: A CSO on vehicle patrol was approached by a visitor who asked if they could direct them to the nearest hospital. The CSO asked the person if they would like an ambulance to transport them they replied in the affirmative. The CSO requested an EMS response and the person was transported away by ambulance."
"220151","2022 04 21","0435","Medical Assist - Other","Residence Hall",1650515700,"Notes: A CSO responded to a request for medical assistance in a residence hall. The CSO met with a student who had sustained an injury earlier in the day and requested the CSO evaluate the injury. The CSO applied first aid, and encouraged the student to follow up with the Health & Counseling Center during their open hours later that day."
"220152","2022 04 21","1706","Damage to Property","Canyon House",1650560760,"Notes: A CSO on patrol of the Canyon house encountered damage to the lawn to the west of the structure. The damage appeared to have been caused by vehicle tires. Grounds staff were notified of the damage."
"220153","2022 04 21","1741","Information Only","Birchwood Apartments",1650562860,"Notes: A CSO on patrol of the Birchwood Apartments encountered a bicycle that was missing both its front and rear tires. The bicycle was secured to the bike rack. The CSO affixed a red CS tag to the bike alerting the owner that the bicycle would be removed in 72 hours if Community Safety was not contacted by the owner. "
"220154","2022 04 21","2033","Graffiti","Sullivan Hall",1650573180,"Notes: A CSO on patrol encountered a new graffito on the northside of Sullivan Hall. Building Services has been contacted for removal of the graffiti."
"220155","2022 04 21","2042","Damage to Property","Theatre Annex ",1650573720,"Notes: CSOs responded to a security alarm at the Theatre Annex. Upon their inspection of the building they noted that a northside window of the old warehouse was cracked. No further signs of suspicious activity were found in the area. Building Services has been contacted for repairs to the window. "
"220156","2022 04 20","2316","Disturbance/Information Only/Subject with Weapon/Suspicious Person","Reed College Apartments",1650496560,"Notes: A CSO responded to multiple noise complaints received from residents of the Reed College Apartments. Upon arrival, the CSO encountered two people, one sitting at a picnic table and one standing nearby holding a knife. The person holding the knife said that they worked at a nearby food truck and that the seated person had approached the truck yelling racial slurs and other unintelligible statements. The person who had been sitting at the table got up, continued to yell unintelligibly, and began walking southward on 28th Ave. The CSO provided the food truck employee with a Reed pink card containing emergency numbers and also recommended the person contact 911 should another emergency arise. "
"220157","2022 04 22","0707","Damage to Property","Chemistry",1650611220,"Notes: CSOs responded to a report of an unknown person walking around campus looking for their vehicle. CSOs contacted the person, but they  declilned to provide their name. The person could not provide any information about the vehicle, except that it was a black truck, and did not remember where the vehicle had been left. CSOs escorted the person off campus. A CSO witnessed a student offer a ride to the person to the East Lot. The CSOs then followed the individual to the chemistry loading dock, where they found a truck stuck in the grass. The person attempted to start the vehicle but when it would not start they gathered their belongings from the vehicle and walked off campus. Police later determined that the truck had been stolen, contacted the owner, and the truck’s owner later came to campus and retrieved it. Police notified CS that the person who had been seen on campus and tried to start the truck had been arrested off campus."
"220158","2022 04 22","1203","Damage to Property","Lower North Lot",1650628980,"Notes: A CSO responded to a report of a vehicle in the Lower North Lot missing its rear window. The CSO located the vehicle and observed that the rear window glass had been shattered. The CSO was unable to determine whether or not any personal items were removed from the vehicle and was unable to contact the owner as the vehicle was not registered with Community Safety."
"220159","2022 04 22","1426","No Contact Order","Campus",1650637560,"Notes: A No Contact Order was issued between two Reed community members."
"220160","2022 04 22","1558","Graffiti","Prexy",1650643080,"Notes: A CSO on patrol encountered new graffiti on a green electrical box north of Prexy. Building Services was contacted for removal of the graffiti."
"220161","2022 04 22","1626","Graffiti","Canyon House",1650644760,"Notes: A CSO on patrol encountered new graffiti painted onto the dumpster corral west of the Canyon House. Building Services was contacted for removal of the graffiti."
"220162","2022 04 22","1656","Information Only","Library",1650646560,"Notes: A CSO on patrol encountered a bicycle chassis missing some parts secured to the bike rack north of the Library. The CSO tagged the bike with a Community Safety red tag. "
"220163","2022 04 22","1847","Health Behavior/Exclusion","Residence Hall",1650653220,"Notes: An exclusion was issued to a visitor who threatened to physically harm CS staff and the individual was escorted off campus."
"220164","2022 04 22","2201","Health Behavior","German House",1650664860,"Notes: A CSO responding to a service request encountered a large gathering of approximately 40-50 students listening to a live band in the basement of the German House. After confirming that the gathering was not a college sanctioned event, the CSO requested the students disperse in accordance with current COVID policy, and the students complied."
"220165","2022 04 23","0133","Graffiti","Chemistry",1650677580,"Notes: A CSO on patrol encountered new graffiti on the north exterior side of the Chemistry building. Building Services was contacted for removal of the graffiti."
"220166","2022 04 23","0333","Graffiti","Eliot Circle/Main Drive",1650684780,"Notes: A CSO on patrol encountered new graffiti on the monolith located at the entrance of the main drive. Building Services was contacted for removal of the graffiti."
"220167","2022 04 23","1540","Information Only","East Lot",1650728400,"Notes: A CSO on patrol encountered a blue moped lying on its side in the East Lot just north of the Language Houses. The CSO observed that the moped appeared to be leaking fuel. The CSO stood the bike back upright and continued on their patrol. "
"220169","2022 04 24","0340","Damage to Property","Naito/Sullivan",1650771600,"Notes: CSOs responded to a request for assistance regarding a bike secured at the Naito/Sullivan breezeway bike rack. Upon arrival, the CSOs met with the owner of the bike. The owner stated that, in what appeared to be an attempted theft of the bike, the U-Lock securing the bike had been damaged and the student was unable to unlock it. A CSO was able to successfully unlock the lock without having to cut it."
"220108","2022 03 28","0933","Suspicious Person/Activity/Circumstances","Chemistry",1648459980,"Notes: A CSO responded to a theft report in the Chemistry building. Upon arrival, the CSO met with a professor who stated that they had entered their office to find it in disarray and with items missing. The professor stated that the only access to their office was from within connecting labs, and students sometimes passed through the office when exiting the labs. The professor stated that their laptop and several related accessories were missing. The professor also noted there were snack wrappers and a couple of other items left lying around the office, none of which were theirs. The CSO sympathized with the professor and recommended they take steps to secure the laptop from identity theft if possible. The CSO was unable to find any signs of forced entry or other tampering to the doors."
